{
  "$schema": "https://json-schema.org/draft/2020-12/schema",
  "$id": "https://skillranger.local/schemas/domain-manifest.schema.json",
  "type": "object",
  "required": ["schemaVersion", "id", "displayName", "version", "coreApi", "skillIdPrefix", "capabilities", "artifacts", "ownership"],
  "properties": {
    "schemaVersion": { "enum": ["1.0", "1.1", "1.2"] },
    "id": { "$ref": "#/$defs/token" },
    "displayName": { "type": "string", "minLength": 1 },
    "description": { "type": "string", "minLength": 1 },
    "version": { "type": "string", "minLength": 1 },
    "releaseVersion": { "type": "string", "minLength": 1 },
    "coreApi": { "type": "string", "minLength": 1 },
    "skillIdPrefix": { "type": "string", "pattern": "^[a-z0-9][a-z0-9._-]*\\.$" },
    "targetSurface": { "$ref": "#/$defs/token" },
    "capabilities": {
      "type": "array",
      "minItems": 1,
      "maxItems": 64,
      "uniqueItems": true,
      "items": { "enum": ["project-signals", "intent-routing", "structured-artifacts", "verification", "repair", "evaluation"] }
    },
    "artifacts": {},
    "ownership": {},
    "routing": { "$ref": "#/$defs/routing" }
  },
  "oneOf": [
    {
      "required": ["schemaVersion", "artifacts", "ownership"],
      "properties": {
        "schemaVersion": { "const": "1.0" },
        "artifacts": { "$ref": "#/$defs/artifactsV10" },
        "ownership": { "$ref": "#/$defs/ownershipV10" }
      },
      "not": { "required": ["releaseVersion"] }
    },
    {
      "required": ["schemaVersion", "artifacts", "ownership"],
      "properties": {
        "schemaVersion": { "const": "1.1" },
        "artifacts": { "$ref": "#/$defs/artifactsV11" },
        "ownership": { "$ref": "#/$defs/ownershipV11" }
      },
      "not": { "required": ["releaseVersion"] }
    },
    {
      "required": ["schemaVersion", "releaseVersion", "artifacts", "ownership"],
      "properties": {
        "schemaVersion": { "const": "1.2" },
        "releaseVersion": { "type": "string", "minLength": 1 },
        "artifacts": { "$ref": "#/$defs/artifactsV12" },
        "ownership": { "$ref": "#/$defs/ownershipV11" }
      }
    }
  ],
  "$defs": {
    "token": { "type": "string", "maxLength": 128, "pattern": "^[a-z0-9][a-z0-9._-]*$" },
    "tags": {
      "type": "array",
      "maxItems": 64,
      "uniqueItems": true,
      "items": { "$ref": "#/$defs/token" }
    },
    "paths": {
      "type": "array",
      "maxItems": 64,
      "uniqueItems": true,
      "items": { "$ref": "#/$defs/path" }
    },
    "path": {
      "type": "string",
      "minLength": 1,
      "maxLength": 256,
      "pattern": "^(?![\\\\/])(?![A-Za-z]:)(?!.*(?:^|[\\\\/])\\.\\.(?:[\\\\/]|$)).+$"
    },
    "artifactsV10": {
      "type": "object",
      "required": ["intents", "schemas", "recipes", "workflows", "validators"],
      "properties": {
        "intents": { "$ref": "#/$defs/paths" },
        "schemas": { "$ref": "#/$defs/paths" },
        "recipes": { "$ref": "#/$defs/paths" },
        "rules": { "$ref": "#/$defs/paths" },
        "examples": { "$ref": "#/$defs/paths" },
        "workflows": { "$ref": "#/$defs/paths" },
        "validators": { "$ref": "#/$defs/paths" },
        "evalSuite": { "$ref": "#/$defs/path" },
        "capabilityRecords": { "$ref": "#/$defs/paths" }
      },
      "additionalProperties": false
    },
    "artifactsV11": {
      "type": "object",
      "required": ["intents", "schemas", "recipes", "workflows", "validators"],
      "properties": {
        "intents": { "$ref": "#/$defs/paths" },
        "schemas": { "$ref": "#/$defs/paths" },
        "recipes": { "$ref": "#/$defs/paths" },
        "rules": { "$ref": "#/$defs/paths" },
        "examples": { "$ref": "#/$defs/paths" },
        "workflows": { "$ref": "#/$defs/paths" },
        "validators": { "$ref": "#/$defs/paths" },
        "evalSuite": { "$ref": "#/$defs/path" },
        "capabilityRecords": { "$ref": "#/$defs/paths" },
        "routingVocabulary": { "$ref": "#/$defs/path" }
      },
      "additionalProperties": false
    },
    "artifactsV12": {
      "type": "object",
      "required": ["intents", "schemas", "recipes", "workflows", "validators"],
      "properties": {
        "intents": { "$ref": "#/$defs/paths" },
        "schemas": { "$ref": "#/$defs/paths" },
        "recipes": { "$ref": "#/$defs/paths" },
        "rules": { "$ref": "#/$defs/paths" },
        "examples": { "$ref": "#/$defs/paths" },
        "workflows": { "$ref": "#/$defs/paths" },
        "validators": { "$ref": "#/$defs/paths" },
        "evalSuite": { "$ref": "#/$defs/path" },
        "capabilityRecords": { "$ref": "#/$defs/paths" },
        "releaseManifest": { "$ref": "#/$defs/path" },
        "routingVocabulary": { "$ref": "#/$defs/path" }
      },
      "additionalProperties": false
    },
    "ownershipV10": {
      "type": "array",
      "minItems": 1,
      "items": { "$ref": "#/$defs/ownershipRuleV10" }
    },
    "ownershipV11": {
      "type": "array",
      "minItems": 1,
      "items": { "$ref": "#/$defs/ownershipRuleV11" }
    },
    "ownershipRuleV10": {
      "type": "object",
      "required": ["intent", "primarySkill", "supportingSkills"],
      "properties": {
        "intent": { "$ref": "#/$defs/token" },
        "primarySkill": { "$ref": "#/$defs/token" },
        "supportingSkills": { "$ref": "#/$defs/tags" },
        "requiresEvidence": { "$ref": "#/$defs/tags" }
      },
      "additionalProperties": false
    },
    "ownershipRuleV11": {
      "type": "object",
      "required": ["intent", "primarySkill", "supportingSkills"],
      "properties": {
        "intent": { "$ref": "#/$defs/token" },
        "primarySkill": { "$ref": "#/$defs/token" },
        "supportingSkills": { "$ref": "#/$defs/tags" },
        "requiresEvidence": {
          "type": "array",
          "minItems": 1,
          "maxItems": 64,
          "items": { "$ref": "#/$defs/requiredEvidence" }
        }
      },
      "additionalProperties": false
    },
    "requiredEvidence": {
      "type": "object",
      "required": ["kind", "id", "allowedSources"],
      "properties": {
        "kind": { "enum": ["domain", "action", "artifact", "intent", "technology", "quality", "constraint", "acceptance"] },
        "id": { "$ref": "#/$defs/token" },
        "allowedSources": {
          "type": "array",
          "minItems": 1,
          "uniqueItems": true,
          "items": { "enum": ["prompt-exact", "prompt-normalized", "prompt-inferred"] }
        }
      },
      "additionalProperties": false
    },
    "routing": {
      "type": "object",
      "required": ["aliases", "intentTags", "artifactTypes", "technologyTags", "projectTags"],
      "properties": {
        "aliases": { "$ref": "#/$defs/tags" },
        "intentTags": { "$ref": "#/$defs/tags" },
        "artifactTypes": { "$ref": "#/$defs/tags" },
        "technologyTags": { "$ref": "#/$defs/tags" },
        "projectTags": { "$ref": "#/$defs/tags" }
      },
      "additionalProperties": false
    }
  },
  "additionalProperties": false
}
