{
  "schemaVersion": "1.2",
  "id": "frontend",
  "displayName": "Frontend",
  "description": "Design, implementation, review, and verification workflows for web interfaces.",
  "targetSurface": "web",
  "version": "1.0.0",
  "releaseVersion": "0.6.0",
  "coreApi": "1.0",
  "skillIdPrefix": "frontend.",
  "capabilities": [
    "project-signals",
    "intent-routing",
    "structured-artifacts",
    "verification",
    "repair",
    "evaluation"
  ],
  "artifacts": {
    "intents": [
      "intents/ownership.json",
      "intents/phases.json"
    ],
    "schemas": [
      "schemas/design-brief.schema.json",
      "schemas/design-direction.schema.json",
      "schemas/design-execution-policy.schema.json",
      "schemas/bounded-repair-request.schema.json",
      "schemas/verification-report.schema.json",
      "schemas/design-rule.schema.json",
      "schemas/craft-catalog.schema.json",
      "schemas/reference-dna.schema.json",
      "schemas/recipe-example.schema.json",
      "schemas/design-variant.schema.json",
      "schemas/visual-critic-report.schema.json",
      "schemas/visual-run.schema.json",
      "schemas/visual-execution-trace.schema.json",
      "schemas/ui-evidence-bundle.schema.json",
      "schemas/model-capability-record.schema.json",
      "schemas/release-manifest.schema.json"
    ],
    "rules": [
      "rules/index.json"
    ],
    "examples": [
      "examples/operational-command-center/example.json",
      "examples/consumer-discovery/example.json",
      "examples/developer-tool/example.json",
      "examples/editorial-content/example.json",
      "examples/marketing-landing/example.json",
      "examples/saas-workspace/example.json",
      "examples/e-commerce/example.json",
      "examples/mobile-consumer-app/example.json"
    ],
    "recipes": [
      "recipes/operational-command-center.json",
      "recipes/consumer-discovery.json",
      "recipes/developer-tool.json",
      "recipes/editorial-content.json",
      "recipes/marketing-landing.json",
      "recipes/saas-workspace.json",
      "recipes/e-commerce.json",
      "recipes/mobile-consumer-app.json"
    ],
    "workflows": [
      "workflows/design-generation.workflow.json",
      "workflows/design-to-code.workflow.json"
    ],
    "validators": [
      "validators/frontend-validation.rules.json"
    ],
    "evalSuite": "evals/frontend/suite.json",
    "capabilityRecords": [
      "capabilities/default-constrained.json"
    ],
    "releaseManifest": "release.json",
    "routingVocabulary": "routing.vocabulary.json"
  },
  "ownership": [
    {
      "intent": "visual-direction",
      "primarySkill": "frontend.visual-design-polish",
      "supportingSkills": [
        "frontend.ux-critique",
        "frontend.design-system"
      ]
    },
    {
      "intent": "tailwind-execution",
      "primarySkill": "frontend.tailwind-ui-polish",
      "supportingSkills": [
        "frontend.accessibility-review"
      ]
    },
    {
      "intent": "design-system",
      "primarySkill": "frontend.design-system",
      "supportingSkills": [
        "frontend.tailwind-ui-polish"
      ]
    },
    {
      "intent": "design-to-code",
      "primarySkill": "frontend.design-to-code",
      "supportingSkills": [
        "frontend.tailwind-ui-polish"
      ],
      "requiresEvidence": [
        {
          "kind": "intent",
          "id": "visual-reference",
          "allowedSources": [
            "prompt-exact",
            "prompt-normalized"
          ]
        }
      ]
    },
    {
      "intent": "ux-review",
      "primarySkill": "frontend.ux-critique",
      "supportingSkills": [
        "frontend.accessibility-review"
      ]
    },
    {
      "intent": "interaction-polish",
      "primarySkill": "frontend.interaction-polish",
      "supportingSkills": [
        "frontend.accessibility-review"
      ]
    },
    {
      "intent": "motion-design",
      "primarySkill": "frontend.motion-design",
      "supportingSkills": [
        "frontend.interaction-polish"
      ]
    },
    {
      "intent": "motion-review",
      "primarySkill": "frontend.motion-audit",
      "supportingSkills": [
        "frontend.performance-review"
      ]
    },
    {
      "intent": "release-review",
      "primarySkill": "frontend.audit",
      "supportingSkills": []
    }
  ],
  "routing": {
    "aliases": [
      "frontend-web",
      "web-ui"
    ],
    "intentTags": [
      "website",
      "web-interface",
      "landing-page",
      "component",
      "responsive-design",
      "next-app-router-review"
    ],
    "artifactTypes": [
      "web-interface",
      "component",
      "page"
    ],
    "technologyTags": [
      "react",
      "nextjs",
      "vue",
      "svelte",
      "tailwind",
      "rsc"
    ],
    "projectTags": [
      "frontend",
      "react",
      "nextjs",
      "web-app"
    ]
  }
}
